Sheet: Sheet1
A1: Year | B1: Month | C1: What happened
A2: of:=[.A16]-31 -> 1954 | B2: February | C2: Michael born
A3: of:=[.A16]-25 -> 1960 | B3: October | C3: Jane born
A4: of:=[.A16]-9 -> 1976 | B4: autumn | C4: Michael starts university
A5: of:=[.A16]-7 -> 1978 | B5: autumn | C5: Jane starts university
A6: of:=[.A16]-6 -> 1979 | B6: October | C6: Michael and Madeleine meet at Cambridge
A7: of:=[.A16]-5 -> 1980 | B7: spring | C7: Michael and Madeleine become lovers
B8: May? | C8: Justine born
B9: August | C9: Micheline conceived
C10: Michael's final exams (4-year course)
A11: of:=[.A16]-4 -> 1981 | B11: April | C11: Micheline born
A12: of:=[.A16]-3 -> 1982 | B12: autumn? | C12: Jane graduates (3-year course), moves to London
C13: Madeleine and Michael split up over Marcel
B14: late | C14: Michael comes into his inheritance
B15: winter | C15: Michael moves into flat with Tom
A16: 1985 | B16: January | C16: [NOVEL STARTS HERE] Jane and Michael meet
B17: September? | C17: Visit to Jane's parents
A18: of:=[.A16]+1 -> 1986 | B18: June | C18: Micheline dies; Michael's disappearance
A19: of:=[.A16]+2 -> 1987 | B19: June | C19: Madeleine dies
A20: of:=[.A16]+3 -> 1988 | B20: March | C20: Michael and Jane get married
C21: Their son is conceived in California
B22: December | C22: Their son is born
A23: of:=[.A16]+5 -> 1990 | B23: October | C23: Their daughter is born
A24: of:=[.A16]+22 -> 2007 | B24: March | C24: Jane and Michael go back to France for their 20th wedding anniversary
C25: [NOVEL ENDS]